{
  "$schema": "https://raw.githubusercontent.com/mthines/gw-tools/main/packages/gw-tool/schemas/gw-config.schema.json",
  "defaultBranch": "main",
  "cleanThreshold": 3,
  "hooks": {
    "checkout": {
      "post": [
        "pnpm install"
      ]
    }
  },
  "autoClean": true,
  "configVersion": 3,
  "root": "/Users/mthines/Workspace/gw-tools.git"
}